Product Name,Description,Type,Price,Price_Value,Pros,Cons,Best For,Link,Image_URL
SpringWell CF1,High-capacity whole-house filter for city water with carbon/KDF stages.,Whole-House,"$1,039 ",1039,"Great contaminant removal, low maintenance",No softening,Municipal homes,https://qualitywaterlab.com/whole-house/springwell-filter-system-review/,https://imgur.com/SVeMiCw
SpringWell WS,Iron/sulfur removal system for well water using air injection technology.,Whole-House,"$2,205 ",2205,"Great for well water, smart features",Pricey,Well water,https://www.springwellwater.com/product/well-water/whole-house-iron-filter/,https://imgur.com/iEndQVv
Aquasana EQ-1000 + Conditioner,Comprehensive filter with optional salt-free conditioner for large homes.,Whole-House,"$2,500 ",2500,Good combo of filter + conditioner,Slower flow,Large homes,https://www.amazon.com/Aquasana-EQ-1000-AST-UV-Whole-Filter-System/dp/B09DTZVTQK,https://imgur.com/tZaUUM4
Kind E-1000,Budget-friendly whole-house carbon system with easy installation.,Whole-House,$770 ,770,"Affordable, easy install",Lower capacity,Budget-conscious users,https://qualitywaterlab.com/whole-house/evo-e-1000-review/,https://imgur.com/XEaY7eB
iSpring RCC7,Affordable reverse osmosis under-sink system with high contaminant removal.,Under-Sink RO,$200 ,200,"Strong performance, good value",Requires plumbing,Under-sink RO seekers,https://www.ispringfilter.com/ac/ispring-rcc7-5-stage-residential-under-sink-reverse-osmosis-water-filter-system-wqa-certified-75-gpd,https://imgur.com/zSDJ7CY
Bluevua RO100ROPOT,Portable countertop RO system with no installation needed.,Countertop RO,$434 ,434,"No install, portable","Expensive, takes counter space","Renters, portable needs",https://www.techgearlab.com/reviews/kitchen/water-filter/bluevua-ro100ropot,https://imgur.com/ObKkR2Z
Clearly Filtered 3-Stage Under the Sink Water Filter System,Advanced under-sink system removing over 200 contaminants.,Under-Sink,$170/yr,170,Removes >200 contaminants,Maintenance cost,Health-conscious households,https://clearlyfiltered.com/products/3-stage-under-the-sink-filter-unit,https://imgur.com/tHsOH2T
Big Berkey,Gravity-fed system ideal for off-grid and emergency use.,Countertop/Gravity,$408 ,408,"No power, high effectiveness","Slow, not NSF-certified",Emergency or off-grid users,https://www.techgearlab.com/reviews/kitchen/water-filter/big-berkey,https://imgur.com/xUgus1O
Brita Pitcher,Simple and affordable pitcher for basic chlorine removal.,Pitcher,$25 ,25,"Cheap, easy to use",Basic filtering only,Basic everyday use,https://www.techgearlab.com/reviews/kitchen/water-filter/brita-everyday-pitcher,https://imgur.com/I6bw8KU
ZeroWater 10-Cup 5-Stage Pitcher,"Pitcher filter with 5-stage filtration, removes virtually all dissolved solids.",Pitcher,$35 ,35,"Excellent contaminant removal, affordable, easy to use.",Filters require frequent replacement.,Individuals seeking high-quality drinking water.,https://shop.culligan.com/products/10-cup-zerowater-pitcher?add_on=50306567995711&selling_plan=8119845183,https://imgur.com/f6KoEy7
RKIN AlcaPure Zero Installation Purifier,"Countertop reverse osmosis system with remineralization, no installation required.",Countertop RO,$375 ,375,"Removes up to 99% of contaminants, adds beneficial minerals, easy setup.","Higher upfront cost, slower filtration rate.",Renters or those seeking installation-free RO systems.,https://rkin.com/products/zero-installation-purifier-countertop-reverse-osmosis-water-filter,https://imgur.com/xcN8oaH
Waterdrop X16-Alkaline Tankless RO System,Under-sink tankless reverse osmosis system with remineralization and smart display.,Under-Sink RO,$599 ,599,"High flow rate, space-saving design, adds minerals back to water.","Requires electricity, professional installation recommended.",Homeowners seeking advanced under-sink RO systems.,https://www.waterdropfilter.com/products/undersink-reverse-osmosis-system-x16,https://imgur.com/NSKOeRD
Santevia Gravity Water System,"Gravity-fed countertop filter that removes contaminants and adds minerals, improving pH.",Countertop/Gravity,$199 ,199,"Enhances taste, adds beneficial minerals, no electricity required.","Slower filtration rate, plastic construction.",Households seeking mineral-rich filtered water.,https://santevia.com/products/gravity-water-system,https://imgur.com/OXQ5Ior
Katadyn BeFree AC 1.0L Water Filter Bottle,"Portable soft bottle with activated carbon filter, ideal for hiking and backpacking.",Portable Bottle,$50 ,50,"Lightweight, easy to clean, improves taste.","Does not remove viruses, limited capacity.",Hikers and backpackers needing portable filtration.,https://www.amazon.com/Katadyn-Ultralight-Collapsible-Camping-Backpacking/dp/B0DT99W4MK?th=1,https://imgur.com/gpcpe3J
LifeStraw Personal Water Filter,Compact straw-style filter that removes bacteria and parasites from water sources.,Portable Straw,$20 ,20,"Extremely portable, no setup required, long lifespan.","Does not filter chemicals or viruses, single-person use only.","Emergency kits, travelers, and hikers.",https://lifestraw.com/products/lifestraw,https://imgur.com/cXxeTcQ
MSR Guardian Purifier,"High-end portable purifier that removes viruses, bacteria, and particulates, suitable for extreme conditions.",Portable Purifier,$200 ,200,"Removes a wide range of contaminants, durable, fast flow rate.","Expensive, heavier than other portable options.",Travelers in areas with questionable water quality.,https://cascadedesigns.com/products/guardian-purifier,https://imgur.com/QcLRNNH
Piurify Alchemy Electric Water Filter Pitcher,"Electric pitcher with ultrafiltration and carbon tech, removes 99% of contaminants quickly.",Electric Pitcher,$70 ,70,"Fast filtration, removes a wide range of contaminants, enhances taste.","Requires electricity, smaller capacity.",Coffee enthusiasts and households seeking quick filtration.,https://www.piurify.com/products/alchemy-automatic-water-filter-pitcher,https://imgur.com/EzfPk2w
